<?xml version="1.0" encoding="UTF-8"?>
<Company xmlns:xsi="http://www.w3.org/2001/XMLSchema-instance" xsi:noNamespaceSchemaLocation="file:///C:/Users/Admin/Desktop/2014A7PS0035U/Company.xsd">
	<Employee ID="12-AAZ">
		<FirstName>FirstName1</FirstName>
		<LastName>LastName1</LastName>
		<ContactNumber>11111</ContactNumber>
		<Email>asdqq@gmail.com</Email>
		<Address>
			<City>Madurai</City>
			<State>Tamilnadu</State>
			<Zip>11111-1111</Zip>
		</Address>
	</Employee>
	<Employee>
		<FirstName>FirstName2</FirstName>
		<LastName>LastName2</LastName>
		<ContactNumber>33333</ContactNumber>
		<Email>vbnma@gmail.com</Email>
		<Address>
			<City>Hyderabad</City>
			<State>Andhra</State>
			<Zip>22222-2222</Zip>
		</Address>
	</Employee>
</Company>
